indice,clip_original,clip_procesado,clip_longitud_original,clip_longitud_procesada,instagram_original,instagram_procesado,instagram_longitud_original,instagram_longitud_procesada,instagram_hashtags,instagram_hashtags_procesados,instagram_menciones,instagram_emojis
45,"a large building in the middle of a desert, white stone temple ruins, maya temples, ancient ruins behind, ruins in the background, ancient ruins in the background, pyramid in background, ruins on the background, ancient city ruins, ancient megastructure pyramid, beautiful ancient ruins behind, monumental giant palace, mayan, ancient city of white stone, temple of the sun, ancient pyramid",edificio desierto ruina templo piedra blanco templo maya ruina antiguo ruina fondo ruina antiguo fondo pirámidir fondo ruina fondo ruina ciudad antiguo antiguo pirámidir megaestructura hermosa ruin antiguo palacio gigante monumental maya maya ciudad antiguo piedra blanco temperamento antiguo piramida antiguo piramida antiguo,390,326,"Los precursores y pioneros del turismo en Muna Don Hector Arana Cabrera y Don Luis Arana Bustillos (descanse en paz)

Sin lugar a dudas Muna ha destacado por ser un sitio turístico de interés y un tanto es debido a la cercanía con la Ruta Puuc, de los primeros guías que trajeron a innumerables conocedores de la cultura maya lo fueron don Héctor Arana Cabrera nacido en muna al igual que su hijo don Luis Arana en la Casa que se encuentra a contraesquina del parque
Fueron ellos los exploradores que llevaron a los primeros arqueólogos al buscar las ciudades mayas perdidas al sur de Yucatán, Quintana Roo y Campeche; como atestiguan numerosas cartas de agradecimiento suscritas por arqueólogos famosos y que Luis conserva como un recuerdo de pasadas y felices aventuras.
Pero esos antiguos guías exploradores no solo la hacían de choferes, ellos mismos preparaban los campamentos, cocinaban y la hacían de mecánicos cuando se necesitaba. Porque en esas expediciones, donde no había población alguna, necesitaban llevar refacciones, bandas, bujías, medicinas, tabaco y ron para las noches y sí, también hacer guardias en la noche mientras los turistas dormían.
Los campamentos de los custodios de los sitios arqueológicos, o de los campamentos madereros y chicleros eran los lugares ideales para pernoctar por la seguridad que los establecimientos ofrecían. Era muy importante mantener las amistades a lo largo de las rutas con estos amigos custodios o capataces de los campamentos, por lo que siempre llevaba pequeños regalos que tanto se aprecian en estas lejanas partes como un paquete de cigarrillos, una botella de ron, un buen cuchillo o un molino para carne. En la región Puuc los sitios intervenidos por el INAH, todos tienen chultunes y/o akalchés para proveer de agua a los vigilantes. Los vigilantes de los sitios alejados tienen sus descansos una vez cada dos semanas y de regreso llevan cargando las mercancías que van a consumir durante ese tiempo, naturalmente cuando Don Héctor los encontraba en el camino, lo menos que hacía por ellos era subir al Jeep la pesada carga, y si había algún lugar disponible llevaba a la esposa y niños hasta su destino en medio de la nada",precursor pionero turismo muna don héctor arán cabrera don luis arán bustillo paz lugar duda mún desestacar sitio turísstico interés lacanía ruta ruto puuc traer cercanía ruta puuc cultura maya don héctor arana cabrera nacido muna hijo don luis arana casa contraesquina parqueser explorador llevar arqueólogo buscar ciudad maya perdido sur yucatán quintana roo campeche atestiguan numeroso cartas agradecimento suscritas arqueólogo famoso luis conservar recuerdo pasada felices antiguos guías exploradores hacía choferes elelos preparaban cocinores cocina hacía hacía coferes preparabanes cocoinatores coco hacina mecánnicos necesitar expediciones poblacia necesitaban refacciones bandas bujías medicinas tabaco ron noches campamentos guardias noche turistas dormina arqueológicos campamentos madereros chicleros lugares ideales pernoctar seguridad establecido recíe importante mantener amistades rutas amigos custodios capataces campamentos llevar pequeños regalos aprecianos lejanas parte carne región puuc sitio intervenido inah chultunes akalchés probador agua vigilante vigilantes sitio alejados descansos semana remeso llevan cargando mercancías consumir tiempo naturalmento don héctor encontrar camino hacer elloal erlos erlos erlos erlos erlelo carga lugar disponible lllevar esposa niño destino,2186,1303,[],[],[],[]
46,"a woman in a white dress and hat walking down a path, carrying a tray, ethiopian, sri lankan landscape, 1990s photograph, white shirts, 1990 photograph, 1987 photograph, 1980s photograph, cuban women in havana, bolivian cholitas, sri lanka, assamese aesthetic, workers",woman dress and hat walking down path carrying tray ethiopiar sri lankan landscape photograph shirts photograph photograph photograph cur women haván boliviar cholita sri lanko assamese aesthetic workers,268,203,"Así lucía #Uxmal la primera vez que la redescubrieron en una expedición entre 18581860??

??Claude-Joseph Désiré Charnay",lucía redescubreír expediciónica desiré charnay uxmal,121,53,['Uxmal'],['uxmal'],[],[]
47,"a police officer stands guard on the side of a road as cars pass by, the last v 8 interceptor, triumph, cars and people, 5 hotrods driving down a street, the car is corvette c2 1969, de tomaso, corvette c2 1969, andrew tate driving a bugatti, police tesla, chase scene, cobra",police officer stands guard the sidir road cars pass the last interceptor triumph cars and people hotrods driving down street the car corvette tomaso corvette andrew tate driving bugatti police teslar chase scene cobrar,275,219,"Ya sea en piedra, jade o arcilla, déjate maravillar por las artesanías que Los Ceibos tienen para ofrecerte. Visita su taller en Muna, y descubre el talento de esta familia de artesanos en cada una de sus piezas. 
#QuédateEnYucatán
#365DíasEnYucatán

Más información en: https://yucatan.travel/experiencia/121-artista-en-vasijas-prehispanicas/",piedra jade arcilla déjate maravillar artesanías ceibos recreación visita taller muna descubre talento familia artesanos pieza información date yucat yucat,343,155,"['QuédateEnYucatán', '365DíasEnYucatán']","['date', 'yucat', 'yucat']",[],[]
48,"a bird flying over a forest filled with trees, huginn and muninn flying above, flying birds in distance, an eagle flying, sri lankan landscape, a spotted dove flying, birds flying in the distance, flying birds in the distance, birds flying away, birds in flight, birds and trees, birds on sky, jungle in background, birds flying in the sunlight",pájaro volar bosque lleno árbol huginn muninn volar volar pájaro distancia águila volar paisaje sri lanka paloma manchado volar ave vuelir distancia ave voladora distancia ave volar ave ave pájaro ave cielo junglo fondo pájaro volar flujo solar luz solar,344,254,"Muy pronto, nuevo espectáculo de Luz y sonido. Esperalo.  ECOS DE UXMAL",eppectáculo luz sonido esperar eco uxmal,71,40,[],[],[],[]
49,"a brick walkway with a sign that says ` ` ` `, partly cloudy sky, the planet, plants environment, partly cloudy day, big planet on background, big disc of planet, planet in the sky, planet, parks and public space, bangalore, parks and monuments, sunny clear sky, panoramic photography, vibrant greenery outside, park background, clear sky above",pasarela ladrillo letrero cielo parcialmente nublado planeta entorno planta parcialmente nublado planeta fondo disco planeta planeta cielo planeta parque espacio público bangalore parque monumento cielo transparente soleado fotografía panorámico vibrante verde exterior fondo parque cielo despejado cielo despejado cielo despejado cielo despejado cielo despejado,344,362,Arte Maya los ceibos. A tu paso por Uxmal visita Muna.  Tendrás la oportunidad de ver y poder comprar reproducciones prehispánicas.  Encuéntralos en calle 13 x 26 y 28 Muna. CP 97840,arte maya ceibos paso uxmal visita mún tenderrás oportunidad compromentar reproducción prehispánica encuentra él calle muna,182,123,[],[],[],[]
50,"a group of mushrooms, ancient alien head stone statues, stone colossus remains, stone statues, megaliths, the three moiras, distopia megaliths, broken statues, ancient astronauts, 3rd century bc, weathered artifacts, brancusi, ancient gods, hellenistic sculptures, hexagonal stones, helmet of a forgotten deity",grupo hongo antiguo estatua piedra cabeza alienígén resto coloso piedra estatua piedra megalito moira megalito distopía estatua roto astronauta antiguo siglo iii,310,161,Uxmal vuelve a abrir sus puertas hoy 22 de marzo.  Visita Uxmal de 8:00 am hasta 4:00 PM para la venta de boletos y como último acceso.  Cierra a las 5:00 Pm,uxmal vuelve abrir puertas marzo visita uxmal venta boletos acceso cerrar,157,73,[],[],[],[]
51,"a black and white photo of a ruined building, destroyed buildings, destroyed castle, ww1 film photo, taken on a ww 1 camera, destroyed church, an atom bomb explosion in mumbai, collapsed buildings, black and white matte painting, ww1 photo, kremlin towers are destroyed, destroyed human structures, destroyed monastery, 1920s archeologically photo, restored photo",blanco negro edificio ruina edificio destruido castillo destruido película guerra mundial tomado cámara guerra mundial iglesia destruido explosión bomba atómico mumbai edificio colapsado pintura mate blanco negro guerra mundial torres kremlin destruido estructura humano destruido destruido monastería arqueológico década arqueado restaurado restaurado restaurado restaurado restaurado,363,385,Uxmal en 1946,uxmal,13,5,[],[],[],[]
52,"a view of a building from a window, vhs footage still, film screenshot, taken on a 1960s kodak camera, taken on 1970s kodak camera, 8 mm film still, screenshot of found footage, vhs footage of a movie set, ancient ruins in the background, color film still 1 9 7 7, from inside the giant palace",vista edificio ventana metraje vhs captura pantalla película tomado cámara kodak década tomado cámara kodak años película captura pantalla imagen encontrado imagen vhs conjunto película ruina antiguo fondo película interior palacio gigante,293,239,Uxmal en 1950,uxmal,13,5,[],[],[],[]
53,"a 360 lens of a person on a skateboard, in ancient city ruins, maya temples, epic vista of old ruins, ancient city ruins, at an ancient city, ancient ruins in the background, trampling an ancient city, beautiful ancient ruins behind, 3 6 0 capture, ancient city, ancient ruins behind, standing before ancient ruins, solar eclipse",lente persona patineta ruina ciudad antiguo templo maya vista épica vieja ruin ruina antiguo ciudad ciudad antiguo ruina antiguo fondo pisotear ciudad antiguo hermosa ruin antiguo captura antiguo ciudad antiguo ruina ruina antiguo ruina solar ruido solar solar,329,260,"Sigue explorando Uxmal y sus pueblos vecinos, cómo Muna y Santa Elena.  Recuerda somos un grupo de locales y te queremos ayudar a planificar mejor tu viaje por nuestras tierras mayas, escríbenos te brindamos asesoría y recomendaciones totalmente gratis. ?? 
#uxmaltravel  #uxmalyucatan  #visituxmal #vist_uxmal?????",explorando uxmal pueblos vecinos muna santa elena recordar grupo locales ayuda planificar viaje tierra maya escríbeno brindar asesoer recomendacación total valor uxmaltravel uxmalyucatar visituxmal vist uxmal,315,208,"['uxmaltravel', 'uxmalyucatan', 'visituxmal', 'vist_uxmal']","['uxmaltravel', 'uxmalyucatar', 'visituxmal', 'vist', 'uxmal']",[],[]
54,"a newspaper clipping of a man and woman, circa 1982, circa 1 9 7 9, circa 1 9 8 4, circa 1970, 1 9 7 8, 1978, 1 9 8 1, 1981, 1977, 1 9 7 7, circa 1 9 6 9, circa 1969",recorte periódico hombre mujer circa circa circa circa circa,165,60,"Si visitas UXMAl de regreso puedes pasar a visitar Muna,  se encuentra camino a uxmal y en ella puedes adquirir diversos productos y servicios.. desde snacks en el super mercado hasta frutas y verduras frescas en su mercado local, servicios de  hospedaje, tours a grutas, vistas panorámicas desde el cerro más alto de Yucatán, y si viajas de Mérida a Uxmal y no encuentras Autobús para llegar con la línea SUR usted puede tomar otro autobús de nombre Mayab y pedirá desender en el poblado de Muna y desde el Centro tomar un taxy para Uxmal. ??? En este timelapse podrás observar el camino de uxmal a Muna 16 Km en 30 segundos.",visitar uxmal regueso puedes pasar visitar muna camino uxmal pluedes adquirir diverso productos servicios snacks super mercado frutas verduras frescas mercado local servicios hospedaje tours gras vista vierduras mercado cerro alto yucatán vijas mérida uxmal encuentras autobús llegar línea sur tomar autobús nombre mayab pedirá desender poblado muna centro tomar taxy uxmal timelapse podrás observar camino uxmal muna segundo,626,425,[],[],[],[]
55,"a painting on a wall in a building, symmetrical painting, aztec iconography, intricate design pop art, intricate symmetrical artwork, nazca design, symmetrical artwork, illusion painting hidden image, wall painting, mexican muralism ) ravi supa, symbolic mural, unique and intricate painting, intricate mural, intricate painting, coherent symmetrical artwork",pintura pared edificio pintura simétrico iconografía azteca arte pop intrincado obra arte simétrico intrincado diseño nazca obra arte simétrico pintura ilusión oculto imagen oculto pintura pared muralismo mexicano ravi supa sínteco síndico mural único intrincado pintura intrincado mural pintura intrincado arte symétrico coherente,358,331,Uxmal en 1939 ?????,uxmal,19,5,[],[],[],[]
56,"a group of people standing around a wall, brutalist aztec architecture, aztec architecture, tenochtitlan, maya temples, 1920s archeologically photo, background depicting a temple, staggered terraces, monumental giant palace, mayan style, 1 9 3 8 photo, 1 9 4 8 photo, 1 9 4 0 picture",grupo persona pie muro arquitectura azteca brutalista arquitectura azteca tenochtitlar templo maya arqueológicamente década fondo representar templo terraza escalonada palacio gigante monumental estilo maya imagen,283,213,"Somos tus guías locales en el sur de Yucatán, envíanos DM y pregúntanos, estamos para ayudarte en tu siguiente viaje",guía lugar sur yucatán envíico pregúntano ayudarte siguient viaje,116,65,[],[],[],[]
57,"a dirt road with a dirt road and bushes, taken on a 1960s kodak camera, color film still 1 9 7 7, 8 mm film still, screenshot of found footage, vhs footage still, screenshot from the 1983 film, taken on 1970s kodak camera, super 8mm photograph, film screenshot, still from a music video",camino tierra camino tierra arbusto tomado cámara kodak década película película captura pantalla imagen encontrado imagen vhs captura pantalla película tomado cámara kodak fotografía súper pantalla película película musical musical,286,232,"¡INFORMACIÓN IMPORTANTE SOBRE LA REAPERTURA DE LA ZONA ARQUEOLÓGICA DE UXMAL!

La reapertura se realizará entre el 14 y 20 de septiembre, ya al tener una fecha establecida se dará a conocer por este medio.

La visita se realizará de lunes a domingo de 8 a 17 h. siendo el último acceso a las 16:00 h. La zona arqueológica únicamente podrá operar al 30% de la capacidad de carga, por lo que al alcanzar la capacidad permitida se restringirá el acceso.

El recorrido está delimitado y no se podrá acceder a todas las estructuras abiertas anteriormente al público, durante el recorrido únicamente se podrán visitar: el Templo del Adivino, el Cuadrángulo de las Monjas, el Juego de Pelota, la Casa de las Tortugas, y el Palacio del Gobernador. Se dispondrá de un tiempo máximo de 2 horas para realizarlo.

El uso de cubrebocas es obligatorio y no se permitirá el acceso sin el uso correcto del mismo. El cubrebocas se utilizará durante todo el recorrido.

No se permitirá el acceso de personas que no aprueben el filtro sanitario. La toma de la temperatura es únicamente en la zona de la frente, por lo que tampoco se podrá ingresar a la zona arqueológica de negarse.

TODAS LAS MEDIDAS SON PARTE DE LA ESTRATEGIA PARA PREVENIR CONTAGIOS DE SARS-COV2 DURANTE LA VISITA, POR LO QUE ES IMPORTANTE SEGUIR LAS INDICACIONES DEL PERSONAL.

¡DISFRUTEMOS EL PATRIMONIO CULTURAL Y CUIDEMOS NUESTRA SALUD!  @yucatanturismo",información importante reapertura zona arqueológica uxmal reapertura realizar septiembre fecha establecido dar visita realizar lunes domingo útimo acceso zona arqueológicar únicése operario capacidad carga alcanzar capacidad permitido restingirier recorrido delimitado accesor únicamé visitar templo adivino cuadrángulo monjas juego pelota casa tortugas palacio gobernador disponer tiempo máximo hora realizarlo cubrebocas obligatorio permitir acceso correcto cubrebocas utilizar recorrido permitir acceso personas aprueben filtro sanitario toma temperatura úicamar zona frente ingresar zona arqueológico negar él personal,1408,622,[],[],['yucatanturismo'],[]
58,"a large pyramid with a tree in front of it, ancient megastructure pyramid, ancient pyramid, pyramid surrounded with greenery, pyramid, giant tomb structures, lost world pyramid, giant aztec spaceship, monumental giant palace, pyramid portal, golden pyramids, the tower of babel, pyramid background, aztec architecture, ziggurat, giant snake castle, tower of babel, monumental structures",large pyramid with tree front ancient megastructure pyramid ancient pyramid pyramid surrounded with greenery pyramid giant tomb structur lost world pyramid giant aztec spaceship monumental giant palace pyramid portal goldir pyramids the tower babel pyramid aztec architecture ziggurat giant snake castle tower babel estructura monumental,386,337,#uxmaltravel  #yucatán #uxmalyucatan #uxmalgrid #uxmal2020 #uxmal,uxmaltravel yucat uxmalyucatar uxmalgrid uxmal uxmal,65,52,"['uxmaltravel', 'yucatán', 'uxmalyucatan', 'uxmalgrid', 'uxmal2020', 'uxmal']","['uxmaltravel', 'yucat', 'uxmalyucatar', 'uxmalgrid', 'uxmal', 'uxmal']",[],[]
59,"a newspaper with a picture of a man in the middle, 1960's olympics, jacqueline e, miles df, 1960's olympics footage, kodachrome 64, kodachrome 6 4, 1 9 6 1, 1961, circa 1 9 6 9, circa 1969, newspaper article, old paper",periódico imagen hombre olímpicos jacqueline mil olympics wearage kodachrome kodachrome circa circa artículo periódico papel antiguo papel antiguo papel antiguo viejo papel,218,172,#uxmaltravel  #yucatán #uxmalyucatan #uxmalgrid #uxmal2020 #uxmal,uxmaltravel yucat uxmalyucatar uxmalgrid uxmal uxmal,65,52,"['uxmaltravel', 'yucatán', 'uxmalyucatan', 'uxmalgrid', 'uxmal2020', 'uxmal']","['uxmaltravel', 'yucat', 'uxmalyucatar', 'uxmalgrid', 'uxmal', 'uxmal']",[],[]
60,"the stage at night, colorful projections, projection design installation, painted on a giant wall, projection mapping, colorful detailed projections, colored projections, wall darkness, mural, mural art, 3 6 0 projection, symbolic mural, digital walls, artwork of a building, wall painting, a gigantic wall, behind the wall, light art, stage background, epic illumination",escenario noche proyección colorida instalación diseño proyección pintado pared gigante mapeo proyección colorida proyección detallado proyección oscuridad pared mural arte mural proyección mural simbólico pared digital obra arte edificio pintura pared pared gigantesco pared arte luz etapa fondo iluminación épico iluminado epético,371,332,#uxmaltravel  #yucatán #uxmalyucatan #uxmalgrid #uxmal2020 #uxmal,uxmaltravel yucat uxmalyucatar uxmalgrid uxmal uxmal,65,52,"['uxmaltravel', 'yucatán', 'uxmalyucatan', 'uxmalgrid', 'uxmal2020', 'uxmal']","['uxmaltravel', 'yucat', 'uxmalyucatar', 'uxmalgrid', 'uxmal', 'uxmal']",[],[]
61,"a photo of a house in the middle of a field, photo taken at night, low light photography, low - light photography, candlelit catacombs, foto realista, underexposed photography, mysterious temple setting, maya temples, render corona, photography at night, volumetric illumination, aztec architecture, background is a low light museum, lumion render",casa campo tomado noche fotografía luz fotografía luz catacumba vela realista fotografía subexpuesta misterioso entorno templo templo maya corona fotografía noche iluminación volumétrico arquitectura azteca fondo museo bajo luz museo bajo luz museo luz lumión,347,259,Entra a nuestro feed para ver la foto ?? completa ???#grid  #uxmaltravel  #yucatán #uxmalyucatan #uxmalgrid #uxmal2020 #uxmalruinasmayas  #uxmalruins,entrar feed complete grid uxmaltravel yucat uxmalyucatar uxmalgrid uxmal uxmalruinasmaya uxmalruins,149,99,"['grid', 'uxmaltravel', 'yucatán', 'uxmalyucatan', 'uxmalgrid', 'uxmal2020', 'uxmalruinasmayas', 'uxmalruins']","['grid', 'uxmaltravel', 'yucat', 'uxmalyucatar', 'uxmalgrid', 'uxmal', 'uxmalruinasmaya', 'uxmalruins']",[],[]
62,"a book with an image of two men in uniform, colonial era street, luis nieves sr, cuban revolution, by George Barret, Sr., manuel sanjulian, by Oswaldo GuayasamÃ­n, ( el dia los muertos ), ivan bolivian, ned kelly, by RenÃ© Auberjonois, by Benito Quinquela MartÃ­n",libro imagen hombre uniforme colonial street luis nieves revolución cubano george barret manuel sanjulian oswaldo guayasamín diar muertos ivan bolivian ned kelly rené auberjonois benito quinquela martí,263,201,Entra a nuestro feed para ver la foto ?? completa ???#grid  #uxmaltravel  #yucatán #uxmalyucatan #uxmalgrid #uxmal2020 #uxmalruinasmayas  #uxmalruins,entrar feed complete grid uxmaltravel yucat uxmalyucatar uxmalgrid uxmal uxmalruinasmaya uxmalruins,149,99,"['grid', 'uxmaltravel', 'yucatán', 'uxmalyucatan', 'uxmalgrid', 'uxmal2020', 'uxmalruinasmayas', 'uxmalruins']","['grid', 'uxmaltravel', 'yucat', 'uxmalyucatar', 'uxmalgrid', 'uxmal', 'uxmalruinasmaya', 'uxmalruins']",[],[]
63,"a large stone structure, maya temples, ancient megastructure pyramid, giant gold head statue ruins, ancient pyramid, ancient alien head stone statues, the oracle of the mayan elders, mayan, stone colossus remains, huge and megalithic, lost world pyramid, giant head statue ruins, giant tomb structures, beautiful ancient ruins behind, epic 3 d oxaguian",estructura piedra templo maya antiguo pirámidir megaestructura ruina gigante cabeza oro antiguo pirámidir antiguo estatua piedra cabeza alienígén oráculo anciano maya maya coloso piedra resto enorme megalítico pirámidir mundial perdido estatua gigante cabeza gigante estructura tumbas gigante hermosa ruin antiguo epic oxagu oxagu cabeza oxagu,352,343,Entra a nuestro feed para ver la foto ?? completa ???#grid  #uxmaltravel  #yucatán #uxmalyucatan #uxmalgrid #uxmal2020 #uxmalmayanruins #uxmalruins,entrar feed complete grid uxmaltravel yucat uxmalyucatar uxmalgrid uxmal uxmalmayanruins uxmalruins,147,99,"['grid', 'uxmaltravel', 'yucatán', 'uxmalyucatan', 'uxmalgrid', 'uxmal2020', 'uxmalmayanruins', 'uxmalruins']","['grid', 'uxmaltravel', 'yucat', 'uxmalyucatar', 'uxmalgrid', 'uxmal', 'uxmalmayanruins', 'uxmalruins']",[],[]
64,"the ruins of the maya maya in mexico, monumental giant palace, maya temples, ancient megastructure pyramid, mayan, ancient pyramid, pyramid surrounded with greenery, trampling an ancient city, mayan style, aztec architecture, beautiful ancient ruins behind, not ruins, ancient city ruins, aztec mythology, giant tomb structures, brutalist aztec architecture, large temples, classic mayan mythology",the ruins the maya maya mexico monumental giant palace maya templ ancient megastructure pyramid mayan ancient pyramid pyramid surrounded with greenery trampling ancient city mayan style aztec architecture beautiful ancient ruins behind not ruins ancient city ruins aztec mythology giant tomb structur brutalist aztec architecture templo mitología mayo clásico,397,359,Entra a nuestro feed para ver la foto ?? completa ???#grid  #uxmaltravel  #yucatán #uxmalyucatan #uxmalgrid #uxmal2020 #uxmalmayanruins #uxmalruins,entrar feed complete grid uxmaltravel yucat uxmalyucatar uxmalgrid uxmal uxmalmayanruins uxmalruins,147,99,"['grid', 'uxmaltravel', 'yucatán', 'uxmalyucatan', 'uxmalgrid', 'uxmal2020', 'uxmalmayanruins', 'uxmalruins']","['grid', 'uxmaltravel', 'yucat', 'uxmalyucatar', 'uxmalgrid', 'uxmal', 'uxmalmayanruins', 'uxmalruins']",[],[]
65,"a man standing in a hole in a wall, foto realista, parce sepulto, un dia de paz, vale encantado, yutja, ( el dia los muertos ), religiÃ³n, photomanipulation, inspired by Oscar RodrÃ­guez Naranjo, apocalyptik city, apocalyps, world seen only through a portal",hombre pie agujero pared realista parce sepulto paz vale encantado yutja muertos religión fotomanipulación inspirado oscar rodríguez naranjo ciudad apocalipty apocalips mundo visto portal,257,187,Entra a nuestro feed para ver la foto ?? completa ???#grid  #uxmaltravel  #yucatán #uxmalyucatan #uxmalgrid #uxmal2020 #uxmalruins,entrar feed complete grid uxmaltravel yucat uxmalyucatar uxmalgrid uxmal uxmalruins,130,83,"['grid', 'uxmaltravel', 'yucatán', 'uxmalyucatan', 'uxmalgrid', 'uxmal2020', 'uxmalruins']","['grid', 'uxmaltravel', 'yucat', 'uxmalyucatar', 'uxmalgrid', 'uxmal', 'uxmalruins']",[],[]
