indice,clip_original,clip_procesado,clip_longitud_original,clip_longitud_procesada,instagram_original,instagram_procesado,instagram_longitud_original,instagram_longitud_procesada,instagram_hashtags,instagram_hashtags_procesados,instagram_menciones,instagram_emojis
21,"a large building with many windows and a lot of rubble, tenochtitlan, brutalist aztec architecture, mayan style, aztec architecture, maya temples, 1920s archeologically photo, mayan, in the art style of quetzecoatl, aztec, destroyed human structures, submerged pre - incan temple, giant aztec space city",edificio ventana escombro tenochtitlar arquitectura azteca brutalista estilo maya arquitectura azteca templo maya arqueológicamente maya estilo artístico ciudad quetzecoatl aztec estructura humano destruido sumergido pre temple gigante aztec ciudad,303,248,"Rally maya 2022 - BIENVENIDOS  a la Z. A de Uxmal, una poesía hecha piedra. 

@rallymayamexico
@yucatanturismo
@planetariomaya 
@mayalandresorts 
@mayalandadventures",rally maya bienvenido uxmal poesía hecho piedra,165,47,[],[],"['rallymayamexico', 'yucatanturismo', 'planetariomaya', 'mayalandresorts', 'mayalandadventures']",[]
22,"a man standing in the dark near a building, walking in a castle, in a castle, shadowy castle background, projection mapping, 3 6 0 projection, standing near a castle, in a dark warehouse, reflection lumen mapping, silhuette, bats flying away from castle, castle background, inside a castle, projection design installation, wall darkness",hombre parado oscuridad cerca edificio caminar castillo castillo fondo sombrío castillo mapeo proyección proyección parado cerca castillo almacén oscuro mapeo lumen reflexión silueta murciélago volar castillo fondo castillo castillo instalación diseño proyección oscuridad pared pared oscuridad pared,336,300,Uxmal by @diafragmas,uxmal,20,5,[],[],['diafragmas'],[]
23,"an old photo of a pyramid in the middle of the desert, museum catalog photograph, 1 9 4 8 photo, ancient pyramid, 1 9 4 0 picture, 1 9 3 8 photo, ancient megastructure pyramid, photo 1960, pyramid, 1 9 7 5 photo, 1 9 3 5, 1935, 1 9 3 4",viejo pirámidir desierto fotografía catálogo museo pirámide antiguo imagen pirámidir megestructura antigua pirámide,235,115,"Uxmal, Cuadrangulo de las Monjas, aproximadamente 1940.",uxmal cuadrangulo monjas apoximadamete,55,38,[],[],[],[]
24,"a black and white photo of a man standing in front of a stone wall, torri gate, 1920s archeologically photo, huge gate, large gate, portcullis, circular gate in a white wall, tenochtitlan, giant archways, photo taken in 1 9 3 0, brutalist aztec architecture",blanco negro hombre parado frente pared piedra puerta torri arqueológicamente década enorme puerta puerta portcullis puerta circular pared blanco tenochtitlar arco gigante tomado arquitectura brutalista azteca,257,209,"1896. Del libro ""Cave hunting in Yucatan"", de Heny C. Mercer, obtuvimos esta singular imagen. Se trata de una vista del Cuadrángulo de las Monjas, en Uxmal, desde la Pirámide del Adivino. Observamos un edificio que aún no era rescatado, en ruinas, muy distinto a como se puede ver en la actualidad. 

Agrego una imagen actual, del mismo conjunto, en la misma posición, tomado del banco de datos del INAH.",caza cueva libro yucatán heny mercer obvuvimos singular imagen vista cuadrángulo monjas uxmal pirámide adivino observar edificio rescatar ruina distinto poder actualidad imagen real enjunto posición tomado banco dato inah,404,221,[],[],[],[]
25,"a black and white photo of a mountain, tenochtitlan, destroyed castle, battlements with soldiers, ancient pyramid, 1987 photograph, ruined castle, 1 9 8 5 photograph, 1990 photograph, 1920s archeologically photo, 1980 photo, picture taken in 1 9 3 0, 1 9 7 5 photo",blanco negro montaña tenochtitlan castillo destruido almena soldado pirámide antiguo fotografía castillo ruina fotografía fotografía arqueológicamente imagen tomado,264,164,"Circa 1920. Elegantes visitantes posan junto  al hermoso Arco que servía de acceso principal al Cuadrángulo de las Monjas en Uxmal, Yucatán.
** Fotografía actual del lugar en los comentarios.

Trabajo de edición realizado por @yucatanpasadoglorioso",elegantes visitantes posan hermoso arco servía acceso director cuadrángulo monjas uxmal yucatán fotografía real lugar comentarios,248,129,[],[],['yucatanpasadoglorioso'],[]
26,"a newspaper article with a photo of two men, tabloid photo, newspaper clippings, newspaper article, newspaper clipping, circa 1970, news coverage, circa 1 9 6 9, circa 1969, 1971, circa 1 9 7 9, 1973, 1 9 7 3, clippings of a fashion magazine",artículo periódico hombre sensacionalista recorte periódico artículo periódico recorte periódico cobertura noticia circa recorte revista moda,241,141,La Osa mayor desde Uxmal - hemisferio norte ????,osa uxmal hemisferio norte,48,26,[],[],[],[]
27,"a view of the ruins of the mayan ruins, ancient ruins in the forest, ancient ruins and waterfalls, las pozas, maya temples, mayan temple in the jungle, ancient city ruins, ancient ruins behind, beautiful ancient ruins behind, jungle background with ruins, old ruins, ruins landscape, in ancient city ruins, abandoned ruins landscape, ruins around, ruins on the background",vista ruina ruina maya ruina antiguo bosque ruina antiguo cascada plas templo maya templo mayas junglo ruina antiguo ciudad ruina antiguo ruina antiguo ruina ruina selva ruina ruina ruina paisaje ciudad ruina ciudad ruina abandonado,371,232,"Año 1891-1893. Así lucía el Palacio del Gobernador en Uxmal, Yucatán, hace más de 120 años, cuando fue visitado y fotografiado por el explorador italo-austro-alemanTeobert Maler, pionero en la conservación del patrimonio arqueológico al denunciar a los exploradores que saqueaban las zonas arqueológicas.
** En los comentarios, fotografía original y fotografía actual. 

Fotografía original en blanco y negro editada, restaurada y coloreada digitalmente para una mejor presentación por @yucatanpasadoglorioso",año lucía palacio gobernador uxmal yucatán años visitado fotogramado explorador maler pionero conservación patrimonio arqueolóngico zonas arqueológico comentarios fotografía original fotografía real fotografía original blanco negro editada restaurada colorada digitalmentar presente,508,282,[],[],['yucatanpasadoglorioso'],[]
28,"the arch of the arch of triumph, which was built in the early, dry archways, arch, archs and walls, 1987 photograph, 1990 photograph, massive arch, 1981 photograph, there are archways, 1 9 8 5 photograph, by Wolf Vostell, damaged vine bridge, 1999 photograph",arco arco triunfo construir arco seco arco arco pared fotografía fotografía arco masivo fotografía arco fotografía wolf vostell puente vino dañado fotografía,258,157,"Un periódico de 1841 publicó este episodio cuando John Lloyd Stephens y Fréderick Catherwood visitaron ( y exploraron Uxmal), ante el ""dueño"" de esas ruinas y piedras mayas. El señor Simón Peón le quiso poner precio o degradar a los monumentos, para que se exhibieran en USA. Bonita idea. Lo más interesante es que Stephens dio esa respuesta. 
Y hoy decimos 
#ElPatrimonioNoSeVende #LasRaícesHablan . Lo dejo aquí como un testimonio de que nuestras ciudades y pueblos originarios NO tienen precio.

?? Uxmal Yucatán México",periódico publicó estedio john lloyd stephens fréderick catherwood visitaron exploraron uxmal dueño ruinas piedras mayas señor simón peón querer degradar monumentos exhibierir idea bonito interesante stephens respesta decimos dejar testimonio ciudad pueblo originario precio uxmal yucatán méxico patrimonio vender ces,522,317,"['ElPatrimonioNoSeVende', 'LasRaícesHablan']","['patrimonio', 'vender', 'ces']",[],[]
29,"a black and white photo of a mountain with a large building on top, by David Wojnarowicz, 1920s archeologically photo, black and white matte painting, cai guo-qiang, by Wolf Vostell, by Toshiko Okanoue, insanely detailed matte painting, by Julian Schnabel, stanley donwood",blanco negro montaña edificio superior david wojnarowicz década arqueológico pintura mate blanco negro cai wolf vostell toshiko okanoue insvolcle insvanamente detallado julian schnabel stanley donwood,272,200,"Año 1952. Turista tomando un descanso en una típica hamaca yucateca, a pie de la Pirámide del Adivino en la zona arqueológica de Uxmal, Yucatán.

Fotografía del Instituto Getty / Earl Leaf

Fotografía editada para una mejor presentación por @yucatanpasadoglorioso",año turista tomar descanso típico hamaca yucateco pastel pirámide adivino zona arqueológico uxmal instituto,263,107,[],[],['yucatanpasadoglorioso'],[]
30,"the ruins of the maya mayan in mexico, monumental giant palace, huge old ruins, maya temples, ancient city ruins, huge giant old ruins, 1990 photograph, beautiful ancient ruins behind, ancient ruins, not ruins, 1999 photograph, ancient ruins behind, ancient city of white stone, post apocalyptic ancient ruins, yann arthus - bertrand",ruina maya maya méxico palacio gigante monumental enorme ruina viejo templo maya ruina antiguo ciudad enorme ruina gigante viejo fotografía hermosa ruin antiguo antiguo ruina antiguo ruin fotografía ruina antiguo ciudad antiguo piedra blanco ruina antiguo apocaltática arthus arthus bertrand bertrand atrasado,333,309,"La Reina Isabel II de Inglaterra y su esposo el Príncipe Felipe de Edimburgo hicieron un recorrido por la zona arqueológica de Uxmal un 27 de Febrero de 1975, en una visita histórica de la monarquía a Yucatán, que abarcó diferentes puntos de la Península y otras partes de México. 

Edición @yucatanpasadoglorioso",reina isabel inglaterra esposo príncipe felipe edimburgo recorrido zona arqueológicar uxmal febrero visita visita histórico monarquía yucatán abarcar méxico edición,313,164,[],[],['yucatanpasadoglorioso'],[]
31,"the ruins of the mayan in the yucatan jungle, pyramid surrounded with greenery, amazon jungle, lost world pyramid, aerial view of an ancient land, ancient alien jungle, lost city, ancient jungle, a massive cathedral in a forrest, ancient ruins in the forest, monumental giant palace, mayan temple in the jungle, amazon rainforest background, jungle in background, pyramids in background",ruina maya jungla yucatán pirámidir rodeado vegetación jungla amazon pirámidir mundo perdido vista aéreo antiguo tierra antiguo junglo alienígén ciudad perdido antiguo junglo catedral masivo frontera ruina antiguo bosque monumental palacio templo maya jungla selva amazon fondo fondo jungla fondo fondo fondo monumental templo maya jungla selva amazon fondo jungla fondo fondo fondo fondo fondo fondo fondo jungle jungle selva jungla fondo fondo fondo fondo fondo fondo fondo fondo fondo fondo fondo fondo fondo fondo fondo fondo fondo fondo fondo fondo fondo fondo fondo fondo,386,577,"La Reina Isabel II de Inglaterra realizó una histórica visita a la Zona Arqueológica de Uxmal el 27 de Febrero de 1975. El pasado 6 de febrero cumplió 70 años de reinado.

Fotografía @headofwindsor

Edición @yucatanpasadoglorioso",reina isabel inglaterra histórico visita zona arqueológico uxmal febrero febero cumplir año,229,91,[],[],"['headofwindsor', 'yucatanpasadoglorioso']",[]
32,"a man sitting down in the woods with a bowl of food, luis nieves sr, miner kilbourne kellogg, fred flintstone eating tamales, klaus schwab eating bugs, inspired by Ralph Burke Tyree, cuban setting, hulton archives, puerto rico, george floyd, frank stephenson, elliot anderson, american canteen, gridless, 1950s photograph",hombre sentado bosque tazón comida luis nieves miner kilbourne kellogg fred flintstone comer tamales klaus schwab eating bugs inspirado ralph burke tyree cuban setting hulton archives puerto rico george floyd frank stephenson elliot american canteen granhon,321,257,"1987 Mi primera visita a Uxmal 

?? Tomás Williams",visita uxmal tomás williams,50,27,[],[],[],[]
33,"a newspaper with a picture of a man in a suit, helio oiticica, tabloid photo, by Penny Rimbaud, circa 1 9 7 9, real photograph on the street, mexican vaquero, photo of the girl, circa 1970, heraldo ortega, foto realista, circa 1982, guerilla heroico",periódico hombre traje helio oiticica sensacionalista penny rimbaud fotografía real calle vaquero mexicano niña heraldo ortega realista circa guerilla heroico,249,158,"Mundo maya, colección de fotos desde Ucrania",mundo maya coleción fotos ucrania,44,33,[],[],[],[]
34,"a man standing in front of a pyramid, ancient megastructure pyramid, ancient pyramid, pyramid portal, pyramid, pyramids in the background, golden pyramids, beautiful ancient ruins behind, lost world pyramid, pyramids, standing before ancient ruins, pyramid in background, giant tomb structures, pyramid surrounded with greenery, ancient ruins behind, maya temples, pyramids style, giant majestic archways",hombre parado frente pirámide pirámidir megaestructura antiguo pirámidir antiguo portal pirámidir pirámidir pirámid fondo pirámid dorado hermosa ruin antiguo pirámid perdido pirámid ruina pie antigua ruin pirámid estructura tumbas gigante pirámid rodeado vegetación antiguo ruin forma ruin pirámid pyramid pirama arco majestuoso,404,328,"Uxmal uno de los más importantes yacimientos arqueológicos de la cultura Maya, localizado en el municipio de Muna, Yucatán.

Fotografía de @maarcoski / Março Sáenz

Edición @yucatanpasadoglorioso",uxmal importante yacimientos arqueológicos cultura localizado municipio muna yucatán fotografía março sáenzedición,195,114,[],[],"['maarcoski', 'yucatanpasadoglorioso']",[]
35,"the ruins of the mayan ruins in chila, mexico, pyramid portal, monumental giant palace, brutalist aztec architecture, ancient megastructure pyramid, archs and walls, symmetric matte painting, surrealistic roman architecture, aztec architecture, maya temples, mayan, symmetrically centered, ancient alien portal, image split in half, mayan style, perfect symmetrical image",ruina ruina maya chila méxico portal piramidal palacio gigante monumental arquitectura azteca brutalista megestructura antiguo piramidal arco muro pintura mate simétrico arquitectura romano surrealista symitectura arquitectura perfecto maya maya mayas maya centrado imagen alienígén antiguo imagen imagen imagen imagen imagen imagen imagen imagen imagen imagen imagen imagen imagen imagen imagen imagen alto imagen imagen imagen imagen imagen imagen imagen imagen imagen imagen imagen alto imagen imagen imagen imagen imagen imagen imagen imagen alto imagen imagen imagen imagen imagen imagen imagen imagen imagen alto imagen imagen,371,632,"Uxmal una poesía hecha piedra.. 

?? https://instagram.com/simonnorfolkstudio?utm_medium=copy_link",uxmal poesía hecho piedra,98,25,[],[],[],[]
36,"a pile of rubble on a hill, old photo of a creepy landscape, landfill, 1 9 4 8 photo, 1 9 4 0 picture, 1 9 3 8 photo, photo 1960, destroyed mountains, landslide road, old photo from the 1930s, occasional small rubble, 1930 photo, 1 9 4 7",pila escombro colina viejo paisaje espeluznante vertedero imagen montañas destruido road deslizant antiguo década combaco pequeño ocasional,237,139,"?? visita del General Álvaro Obregón a Uxmal en 1920. Una foto que un fotógrafo famoso de Mérida, de origen español, tomó cuando el candidato a la presidencia de México, pasó por Uxmal. No lo publico (a él) pero fue en esas fechas y en esos días de campaña.

?? ?? Martin Enrique",visita general álvaro obregón uxmal fotógrafo famoso mérida origen español tomó candidato presidencia méxico pasó uxmal público lastero fecha campaña martin enrique,279,164,[],[],[],[]
37,"the sun sets over the ruins of chila, mexico, pyramid ruins at sundown, ancient megastructure pyramid, ancient pyramid, maya temples, temple of the sun, mayan, pyramid surrounded with greenery, lost world pyramid, pyramid, pyramid portal, giant aztec spaceship, monumental giant palace, aztec architecture, sacred ancient architecture, mayan style, large temples, cathedral of sun",the sun set over the ruins chila mexico pyramid ruins sundown ancient megastructure pyramid ancient pyramid maya templ temple the sun mayan pyramid surrounded with greenery lost world pyramid pyramid pyramid portal giant aztec spaceship monumental giant palace aztec architecture sacred ancient architecture mayan style templo catedral sol,380,339,"Uxmal: portal místico de entrada a la #RutaPuuc ???

La Zona Arqueológica de #Uxmal, conocida como la Tres Veces Construida y declarada Patrimonio Cultural de la Humanidad por la UNESCO en 1996.

¡Visítala! ?? https://bit.ly/3gLleAM",uxmal portal místico entrada ruta puuc uxmal,234,44,"['RutaPuuc', 'Uxmal']","['ruta', 'puuc', 'uxmal']",[],[]
38,"a man standing on top of a rock looking at the ruins, maya temples, ancient ruins behind her, panorama of crooked ancient city, in ancient city ruins, beautiful ancient ruins behind, ancient city ruins, panoramic centered view of girl, ancient ruins and waterfalls, ancient ruins in the background, beautiful panoramic imagery, standing before ancient ruins, wide angle lens photography",hombre parado roca mirar ruina templo maya ruina antiguo panorama ciudad antiguo torcido ruina antiguo ciudad hermosa ruin antiguo ruina antiguo ciudad vista panorámico centrado niña ruina antiguo cascada ruina antiguo fondo imagen panorámica imagen pie ruina antiguo ruido amplio angular ángulo,386,295,"La llamada Reina de Uxmal es esta pieza elaborada entre el 600-900 d.C. en la zona arqueológica mencionada en #Yucatán. Posiblemente es el retrato de un gobernante o sacerdote con escarificaciones en forma de espirarl en el rostro.Emerge de las fauces de una serpiente estilizada.

Vía: El Espejo Humeante",llamada reina uxmal pilaza elaborada zona arqueológicar mencionado posibilidad retrato gobernante sacerdota concarificaciones forma espirarl rostro emerge fauces serpiente espejo humeante yucat,307,193,['Yucatán'],['yucat'],[],[]
39,"the ruins of the ancient city of chila, maya temples, mayan, beautiful ancient ruins behind, monumental giant palace, ancient ruins behind, mayan style, temple of the sun, ancient ruins in the background, standing before ancient ruins, large temples, ancient city ruins, white stone temple ruins, mayan temple in the jungle, ancient megastructure pyramid",ruina antiguo ciudad chila templo maya mayas hermosa ruin antiguo palacio gigante monumental ruina antiguo estilo maya templo sol ruina antiguo fondo pie ruina antiguo templo ciudad ruina templo piedra blanco templo mayas jungla,354,228,"¡Impresionante el adivino!

?? JD Bertoni",bertoni,41,7,[],[],[],[]
40,"a building with a projection projected on it, projection mapping, projection design installation, colorful projections, colorful detailed projections, colored projections, 3 6 0 projection, digital graffiti landscape, reflection lumen mapping, digital walls, holographic projection, lan mcque, led screens, painted on a giant wall, digital screens on the walls, wall painting, 3d lighting",edificio proyección proyectado mapeo proyección instalación diseño proyección proyección colorida colorida proyección detallado proyección proyección paisaje digital graffiti mapeo lúmén reflexión pared digital proyección holográfico lan mcque pantalla liderado pintado pared gigante pantalla luz digital pared dolor pared dolor pared,388,334,"Personas afortunadas escalando la pirámide del adivino en uxmal 

Créditos a quien corresponda..",persona afortunado escalando pirámide adivino uxmal créditos correspondiente,96,76,[],[],[],[]
41,"a man standing next to a jeep in the woods, film still of barack obama, screenshot of found footage, jeep in background, color film still 1 9 7 7, still from a music video, screenshot from a movie, still shot from movie, mud, 1 9 8 0 movie still, mahindra thar, still from a movie, still from a nature documentary",hombre parado jeep bosque película barack obama captura pantalla imagen encontrado jeep fondo películar musical captura pantalla película filmado película lodo película mahindra thar película documental naturaleza,313,213,"Que bellos momentos en uxmal. 

?? - @luis_morales_jr",bello momento uxmal,53,19,[],[],['luis_morales_jr'],[]
42,"a newspaper piece with a picture of a man in a suit, circa 1958, jacqueline e, circa 1970, circa 1969, circa 1 9 6 9, 1958, 1 9 5 8, 1959, circa 1 9 7 9, 1 9 6 1, 1961, 1962",pieza periódico hombre traje jacqueline,173,39,"Conoce los vuelos panorámicos en Yucatán, visita Uxmal desde el aire con @iflyaviacion  @iflyexperience  @bwwoolrich",conocer vuelos panorámicos yucatán visita uxmal aire,116,52,[],[],"['iflyaviacion', 'iflyexperience', 'bwwoolrich']",[]
43,"a group of men riding horses down a dirt road, damaged vine bridge, 1920s archeologically photo, foto realista, restored photo, trench crusade, historical footage, steel bull run, real photograph, live-action archival footage, realistic old photo, realistic old photograph, aqueducts, historical photo, photo realisitc",grupo hombre montar caballo camino tierra puente vid dañado arqueológico década realista restaurado cruzado trinchera metraje histórico acero bull run fotografía real imagen archivo acción vivo antiguo realista fotografía antiguo realista acuquesceducto histórico realisitc,318,273,"?????? ATENCIÓN ??????

ESTE MARTES 9 DE NOVIEMBRE ABRE AL PUBLICO ""ECOS DE UXMAL""

De lunes a domingo; Habrá tres presentaciones por día: a las 19:30 horas, a las 20:15 horas y a las 21 horas. 

A partir de este lunes 8, los interesados podrán adquirir sus boletos en la página culturyucatan.com, donde hallarán información y los enlaces respectivos. Las entradas también se vendrán en las taquillas del parador turístico.",atenga presentaciones horas horas horas lunes interesados adquirir boletos página hallar información enju respetivos entrada venir taquillas parador turísstico,423,159,[],[],[],[]
44,"a large pyramid with a bird flying over it, ancient megastructure pyramid, ancient pyramid, lost world pyramid, pyramid ruins at sundown, ruined alien structures, old ruins tower, maya temples, beautiful ancient ruins behind, ancient ruins in the background, an intact ancient alien ship, pyramid, ruins in the background, pyramid surrounded with greenery, giant tomb structures",pirámidir pájaro volar antiguo pirámidir megaestructura antiguo pirámidir pirámidir mundo perdido ruina pirámidir atardecer estructura alienígena ruina torre vieja ruin templo maya hermosa ruin antiguo ruina antiguo fondo antiguo barco antiguo intacto pirámid ruina ruin fondo pirámid cerca greenery ruina gigante timb antiguo nave alienígén,378,341,"El palacio del gobernador en Uxmal, Yucatán en México. En una fotografía tomada en el año de 1882 por el explorador francés Désiré Charnay.",palacio gobernador uxmal yucatán méxico fotografía tomado año explorador francés désiré charnay,139,95,[],[],[],[]
