indice,clip_original,clip_procesado,clip_longitud_original,clip_longitud_procesada,instagram_original,instagram_procesado,instagram_longitud_original,instagram_longitud_procesada,instagram_hashtags,instagram_hashtags_procesados,instagram_menciones,instagram_emojis
0,"the ruins of chichena, maya temples, beautiful ancient ruins behind, white stone temple ruins, ancient ruins behind, ancient temple ruins, ancient city ruins, ancient ruins in the background, mayan, ruins in the background, standing before ancient ruins, ruins on the background, temple ruins, ancient ruins and waterfalls, ancient ruins behind her, archeological discover, large temples",ruina chichena templo maya hermosa ruin antiguo ruina templo piedra blanco ruina antiguo antiguo ruina templo antiguo ruina ciudad antiguo ruin fondo mayas ruina fondo pie antigua ruin ruina ruina templo ruina antiguo ruina cascada antiguo ruin descubrimiento arqueológico temperatura temperatura templo ruin ruina templo antiguo ruina cascada antiguo ruin descubrimiento arqueológico temperatura temperatura templo ruin ruina templo antiguo ruina cascada antiguo ruin descubrimiento arqueológico templo temperatura ruin templo ruina antiguo ruina cascada antiguo ruin,387,568,"La casa real sueca comparte esta bella imagen de los reyes, Carlos XVI Gustavo y Silvia, desde #Uxmal, para dar por terminada su visita oficial a nuestro país ???? ¡Qué guapos! ????????????

#VanidadesMx ?? @kungahuset",casa real sueca comarte bella imagen reyes carlos xvi gustavo silvia terminada visita oficial país guapos uxmal vanidad,218,119,"['Uxmal', 'VanidadesMx']","['uxmal', 'vanidad']",['kungahuset'],[]
1,"a man in a ham ham ham ham ham ham ham ham ham ham ham ham ham ham ham ham ham, yutja, ancient pyramid, victo nga, foto realista, pyramid in background, remedios varo uranga, travel ad, by Sergio LarraÃ­n, lost world pyramid, pyramid, real vintage photo, ancient megastructure pyramid",hombre ham ham ham ham ham ham ham ham ham ham ham ham ham ham ham ham ham yutja ancient pyramid victo nga realista pirámidir fondo remedios varo uranga viajes sergio larraín pyramid world lost pyramid real vintage ancient megestructure pyramid,284,244,"EXCAVACIONES ARQUEOLÓGICAS UXMAL??
Develando las Maravillas del México Antiguo.
¬¬¬¬¬¬¬¬¬¬¬¬¬¬¬¬¬¬¬¬¬¬
Yucatán, Mx.

Al sur de Yucatán emerge con espectacularidad la zona arqueológica de Uxmal, declarada por la UNESCO Patrimonio de la Humanidad.

Se trata de una de las zonas arqueológicas de la cultura maya cuya arquitectura es de las más majestuosas de Yucatán. Su belleza se caracteriza por tener palacios bajos y horizontales, colocados alrededor de patios o cuadrángulos, los cuales son ricos en decorados de esculturas muy detalladas elaborados con miles de pequeñas piedras perfectamente pulidas y ajustadas formando mosaicos geométricos de una perfección no igualada en toda la zona maya.

Se dice que la ciudad de Uxmal fue fundada por la tribu de los Xiues. La ocupación del sitio se remonta al Preclásico superior a.C., sin embargo el mayor volumen de la obra constructiva se realiza durante el Clásico Tardío (600- 1000 d.C.). Tuvo una población de 20,000 habitantes aproximadamente.

¬¬¬¬¬¬¬¬¬¬¬¬¬¬¬¬¬¬¬¬¬¬¬
""Nuestro pasado prehispánico más vivo que nunca""
¬¬¬¬¬¬¬¬¬¬¬¬¬¬¬¬¬¬¬¬¬¬¬
Sigan  Maravillas del México Antiguo / ADV Estudio",excavación arqueológico uxmal develar maravilla mexo antiguo yucatán sur yucatán emerger epectacularidad zona arqueológico uxmal declararado unesco patrimonio zona arqueológico cultura maya cuyo arquitectura máso majestuoso yucatán belleza caracterizar palacio bajos horizontal colocados alrededo patio cuadrángulo ricos decorado escama escama elaborado elaborado milla piqueña piedras perfectamament pulidas ajustadas masacos milla perfección igualada zona ciudad uxmal fundada tribu xiues ocupacia sitio remontar preclásico superior alcalde alcalde obra constructivo realizar clásico tardío poblacia habitante hábitant prehispánico vivo sigan maravillas méxico antiguo adv estudio,1145,682,[],[],[],[]
2,"a large stone building, taken on a 1960s kodak camera, taken on 1970s kodak camera, screenshot of found footage, color film still 1 9 7 7, levitating citadel, vhs footage still, screenshot from the 1983 film, 8 mm film still, still from a music video, ruins in the background",edificio piedra tomado cámara kodak década tomado cámara kodak años captura pantalla imagen encontrado película levitar ciudadela metraje vhs captura pantalla película musical ruina fondo fondo,275,193,Inauguración del parque hundido del palomar ?? Uxmal,inauguracia parque hundido palomar uxmal,52,40,[],[],[],[]
3,"a group of people standing around a motorcycle, one motorbike in center of frame, auction catalogue photo, old photo from the 1930s, museum catalog photograph, ebay photo, 1970s philippines, motorcycles, museum archival photo, 1948, without helmet, 1961â, 1947, 1 9 4 7",grupo persona encontrar motocicleta moto centro marco catálogo subasta antiguo década fotografía catálogo museo ebay filipinas años motocicleta archivo museo casco,271,163,,,0,0,[],[],[],[]
4,"a black and white photo of a dirt road, tribe huts in the jungle, mud and brick houses, 1970s photo, 1 9 7 0 s photo, 1970s, 1 9 7 0 s, c1976, las pozas, colombia en los aÃ±os 60, 1970s philippines",blanco negro camino tierra tribe huts the jungle mud and brick houses pozas colombia años filipinas,197,99,"El imperio de Uxmal, Yucatán ??

Foto:@robertoestrada",imperio uxmal yucatán,53,21,[],[],['robertoestrada'],[]
5,"a building with a projection projected on it, projection design installation, colorful detailed projections, projection mapping, colored projections, colorful projections, walls of large moving images, digital walls, digital screens on the walls, mexican muralism ) ravi supa, palace background, wall darkness, a gigantic wall, wall, giant led screens, freddy mamani silvestre facade",edificio proyección proyectado instalación diseño proyección colorida proyección detallado mapeo proyección proyección proyección colorida pared imagen movimiento pared digital pantalla digital pared muralismo mexicano ravi supa fondo palacio oscuridad pared pared gigánico pared pantalla gigante lidera pantalla franja silvestre freddy mamani silvestre facade fondo pared pared pared gigánico pared pantalla gigante pantalla led freddy mamani silvestre facade fackedes,383,469,"Uxmal Mérida, Yucatán. Uxmal alcanzó su apogeo entre los siglos VII y X. Más tarde, a principios del II milenio, fue abandonada. La cd. está orientada según ciertos fenómenos astronómicos (como el movimiento de Venus) y adaptada a un terreno ondulado. El estilo constructivo de la ruta constituye toda una escuela arquitectónica dentro del arte maya y para muchos es el más sofisticado. La decoración es aquí especialmente rica y nos habla tanto de la importancia de estos poblados, como de la elaborada cosmogonía maya.",uxmal mérida yucatán uxmal alcanzar apogeo siglos vii principios milenio abandonada orientada fenómenos astronómicos movimento venus adaptada terreno ondulado estilo constructivo ruta constituye escuela arquitectónica arte maya sofisticado decoración especialmental rica importancia poblados elaborado cosmogonía maya,520,317,[],[],[],[]
6,"a car is parked in front of a large arch, imet2020, in a race competition, cinematographic wide angle shot, sun shines down on the car, cars and people, perseides meteor shower, coban, dakar rally footage, city of armenia quindio, renault ultimo, mexico, full view of a car, race",automóvil estacionado frente arco competencia racial disparo cinematográfico angular sol brilla automóvil auto persona ducha meteorito persecución metraje rally dakar ciudad armenia quindio renault méxico vista completo automóvil carrera carrera carrera,279,253,Uxmal 1929 fotografía del archivo personal de Miguel Quintal de #Muna ??,uxmal fotografía archivo personal miguel quintal muna,72,53,['Muna'],['muna'],[],[]
7,"the ruins at tupi, maya temples, angkor wat, angkor thon, angkor, large temples, ancient city, ancient indonesia, ancient temple, temple run, mayan temple in the jungle, at an ancient city, ancient temple ruins, mysterious temple setting, sacred ancient architecture, white stone temple ruins, temples, temple background, ancient city of white stone",ruina tupi maya templos angkor wat angkor thon angkor templo ciudad antiguo antiguo indonesia templo antiguo templo run templo mayano jungla ciudad antiguo ruisa templo antiguo misterioso templo arquitectura sagrada antiguo arquitectura ruina templo piedra blanco templo templo fondo antiguo templo templo piedra blanco,349,319,"El Poderoso Adivino, Uxmal. ?
2023
instagram.com/oswaldomatu

@oswaldomatu",poderoso adivino uxmal oswaldomatu,74,34,[],[],['oswaldomatu'],[]
8,"the ruins of the ancient city of ang ang ang ang ang ang ang ang ang ang ang ang ang ang, maya temples, mayan temple in the jungle, ruined temple covered with moss, huge old ruins, beautiful ancient ruins behind, ancient alien jungle, ancient ruins in the forest, huge giant old ruins, post apocalyptic ancient ruins, ancient city ruins, nature taking over",ruina antiguo ciudad ang ang ang ang ang ang ang ang ang ang ang ang templo maya templo maya jungla templo ruina cubierto musgo enorme ruina antiguo hermosa ruin antiguo antiguo junglo alien,356,190,Muna Yucatán,muna yucatán,12,12,[],[],[],[]
9,"a plane flying in the sky, vibrant blue sky background, blue sky background, light blue sky, clean blue sky, pure blue sky, light blue clear sky, sky blue, solid blue background, blue and clear sky, clear summer sky background, blue clear sky, azure blue sky, azure sky tones, blue backdrop. hd, blue clear skies, clear blue sky",avión volar cielo fondo vibrante cielo azul fondo cielo azul cielo azul cielo azul limpio cielo azul puro cielo azul cielo azul fondo azul sólido cielo azul cielo transparente fondo cielo verano cielo azul cielo azul azul cielo azul tono azul fondo azul cielo azul azul cielo azul,328,280,"Circa 1900. Un lugareño observa con detenimiento la grandeza del Cuadrángulo de las Monjas de Uxmal, cuando literalmente se encontraba en ruinas. La vista es de Oriente a Poniente, desde una de las puertas colapsadas, cuyas vigas de madera que le daban soporte, sucumbieron con el tiempo o fueron robadas.
* * Fotografía reciente del lugar en los comentarios.

Fotografía original en blanco y negro editada, restaurada y coloreada digitalmente por @yucatanpasadoglorioso",lugareño observa detenimiento grandeza cuadrángulo monjas uxmal literal enredanans ruinas vista oriente poniente puertas colapsadas cuyas vigas madera dar soporte sucumbieron tiempo robadas fotografía recente lugar comentarios,470,226,[],[],['yucatanpasadoglorioso'],[]
10,"the ruins of the maya maya maya maya maya maya maya maya maya maya maya maya maya maya maya maya maya, maya temples, ancient ruins in the forest, ancient ruins behind, beautiful ancient ruins behind, jungle background with ruins, ruined temple covered with moss, huge old ruins, ancient city ruins, epic vista of old ruins, mayan temple in the jungle, abandoned ruins landscape",ruina maya maya maya maya maya maya maya maya maya maya maya maya maya maya maya maya templo maya ruina antiguo bosque ruina antiguo hermosa ruin antiguo fondo jungla ruina templo ruidoso cubierto musgo ruina antiguo ruina ciudad visto épica viejo ruina mayor mayor ruina cubierto ruina ruina enorme ruina antiguo visto épica vieja ruin mayor mayor ruina cubierto ruido abundante ruina ruina antiguo ruin visto épica antigua ruin mayor mayor jungle jungle abastecido jungle selva ruina ruina antiguo ruina antiguo ruina viejo ruina selva paisaje,377,545,"THE UXMAL ADVENTURE ??
.
.
.
#travel #photography #photooftheday #artist #cool #friends #yucatan #igers #art #travelphotography #",aventura uxmal travel photography photooftheday artist cool friends yucatar iger art travelphotography,129,102,"['travel', 'photography', 'photooftheday', 'artist', 'cool', 'friends', 'yucatan', 'igers', 'art', 'travelphotography']","['travel', 'photography', 'photooftheday', 'artist', 'cool', 'friends', 'yucatar', 'iger', 'art', 'travelphotography']",[],[]
11,"a large elephant standing in the middle of a forest, lush forest foliage, elf forest background, green trees, trees in the grassy hills, green flora forest, deforested forest background, dense with greenery, forested background, background lush vegetation, dense forest, dense vegetation, lush vegetation in the center, lush green forest, the treetops of giant oaks",elefante bosque exuberante follaje bosque fondo bosque elfo árbol verde árbol colina cubierto hierba bosque flora verde fondo bosque deforestado denso vegetación fondo boscoso vegetación exuberante bosque denso vegetación denso vegetación exuberante centro bosque verde bosque gigante gigante gigante gigante,365,308,"México sorprendente, échenle un vistazo a la maravillosa #zonaarqueologicauxmal un lugar lleno de misticismo e historia. Lo encuentras a una hora de #meridayucatan. Si vas a este increíble lugar te recomiendo zapato cómodo, bloqueador,sombrero o gorra y mucha actitud para caminar por este bello lugar. 
?? @paco_jsj 
?? @visit_uxmal",méxico sorprendente échenle vistazo maravillosa lugar lleno misticismo historia encuentra hora vas increíble lugar recomiendo zapato cómodo bloqueador sombrero gorra actitud caminar bello lugar zonaarqueologicauxmal meridayucatar,333,229,"['zonaarqueologicauxmal', 'meridayucatan']","['zonaarqueologicauxmal', 'meridayucatar']","['paco_jsj', 'visit_uxmal']",[]
12,"a building with a lot of grass on top, matte painting finish, aqueducts, high quality matte painting, matte painting unreal engine, panoramic photography, 3d rendered matte painting, abandoned ruins landscape, attack on titan scenery, photorealistic matte painting, cgsociety 9, flat matte painting, auschwitz camp, highly detailed matte painting, organic matte painting, matte painting",building with lot grass top mattir painting finish aqueducts high quality matte painting matte painting unreal engine panoramic photography rendered matte painting abandoned ruins landscape attack titar scenery photorealistic matte painting cgsociety flat matte painting auschwitz camp highly detailed matte painting organic matte pintura pintura mate,386,351,"Visita Muna y descubre los detalles que estas letras turísticas tienen para tí.  Ubicado a 16 km de Uxmal, sobre la carretera Mérida - Uxmal

¡Letras pintadas a mano ? - por artistas locales!",visitar muna descubre detless letras turíssticas ubicado uxmal carretera mérida pintado mano local artista,191,106,[],[],[],[]
13,"a large pile of rubble next to a building, ancient megastructure pyramid, tenochtitlan, las pozas, staggered terraces, ancient pyramid, 1 9 7 5 photo, 1 9 7 0 s photo, 1970s photo, brutalist aztec architecture, maya temples, pyramid, terraces, lost world pyramid, c1970",pila escombro edificio pirámidir megaestructura antiguo tenochtitlar plas terraza escalonada pirámidir antiguo arquitectura azteca brutalista templo maya pirámidir terraza piramida mundial perdido,269,196,Inhala & exhala ???????y comienza tu semana!!! Hoy una postal de la increíble zona arqueológica de #uxmal,inhala exhalar comenzar semana postal increíble zona arqueológico uxmal,105,71,['uxmal'],['uxmal'],[],[]
14,"a black and white photo of a hill, ancient pyramid, pyramid, maya temples, tikal temple iv, pyramid surrounded with greenery, ancient megastructure pyramid, mayan temple in the jungle, pyramid ruins at sundown, ziggurat, tenochtitlan, pyramid portal, lost world pyramid, museum catalog photograph, mayan, giant tomb structures, temple of the sun",blanco negro colina pirámidir antiguo pirámidir templo maya templo tikal pirámidir rodeado vegetación antiguo pirámidir megaestructura templo maya junglo ruina pirámidir sol zigurat tenochtitlar portal pirámid,345,209,Algunas notas de prensa de la visita de Jacqueline Kennedy a Uxmal en marzo de 1968.,nemas prensa visita jacqueline kennedy uxmal marzo,84,50,[],[],[],[]
15,"a black and white photo of a building with people, brutalist aztec architecture, tenochtitlan, 1920s archeologically photo, aztec architecture, crumbling masonry, el anatsui, foto realista, building crumbling, las pozas, remedios varo uranga, monumental giant palace, mayan style, submerged pre - incan temple",blanco negro edificio gente arquitectura azteca brutalista tenochtitlar arqueológico arquitectura azteca mampostería desmoronado anatsui realista construcción construcción poza remedio varo uranga palacio gigante monumental estilo maya estilo maya sumergido pre,309,261,"Uxmal. Zona Puuc. Yucatán, México.

La Pirámide del Adivino, también llamada del hechicero, del enano o del gran Chilán. Construcción maya de 35 metros de altura, con una base de 53,5 metros en el lado mayor.

La leyenda

Según relató el investigador estadounidense John Lloyd Stephens en sus Incidentes de viaje a principios del año 1840, cuenta la leyenda que este edificio fue construido en una sola noche por un enano, nacido de un huevo encontrado por una bruja cerca de Uxmal. El niño nació con la capacidad de adivinar el futuro, por lo que fue llamado el adivino.

Un día, el enano descubrió un tunkul (instrumento de percusión de madera) y se puso a tocarlo. De acuerdo con las profecías, era sabido que cuando alguien tocase ese instrumento y su sonido repercutiera en toda la región, obtendría el trono de la ciudad, de modo que cuando fue escuchado por el rey de Uxmal, éste identificó el sonido como el anuncio del fin de su reinado.

Dispuesto a enfrentarse a su destino, el rey llamó al enano para someterlo a varias pruebas difíciles que el joven aprobó con éxito. Finalmente, sobrevivió a la más difícil: romper sobre su cabeza, con un mazo de piedra, una cesta de cocoyoles (una especie de frutos muy duros). El soberano se sometió en castigo a la misma prueba, y murió en el acto después del primer golpe. Así comenzó en Uxmal el reinado del enano adivino.",uxmal zona puuc yucatán pirámide adivino llamada hechicero enano chilán construcción maya metro alta base metro leyendasegúnn relató investigador estadounidense john lloyd stephens incidente viaje año leyenda edicio fuer enano nacido huevo encontrado bruja cerca uxmal niño nacer capacidad adivinar futuro llamar enano descubrioon tunkul instrumento percusión madera poner tocar él profecias sabido alguien tocase instrumento sonido repercutierar región obdendriar trono ciadad porl rey uxmal identificado sunundo anunnedo enfrentarso destino rey llamó enano someter él pruebas difíciles joven aprobó éxito finalme sobrevivió difícil romper cabeza mazo piedra cesta cocoyoles especie frutos duros soberano castigo prueba murió acto crimer golpe comenzar uxmal reinado enano adivino,1375,781,[],[],[],[]
16,"a red car driving down a street in the middle of a city, motion blur bokeh, panning shot, extreme motion blur, heavy motion blur, soft motion blur, speed blur, massive motion blur, motion blur, 1958 ferrari 250 gt, autofocus, heavy jpeg artifact blurry, anamorphic bokeh and lens flares",automóvil rojo conducir calle ciudad motion bokeh bokeh tray blowe motion motion desenfocar movimiento pesado desenfocar movimiento suave desenfocar velocidad desenfocar movimiento masivo desenfocar movimiento ferrari autofoco pantalón artefacto jpeg pesado bokeh anamórfico carpa lensa carpa lent lent,286,302,"Corredor Artesanal Muna 2022 

¡Del 5 al 15 de agosto! 

Visítanos",corredor artesanal muna agosto visítano,66,39,[],[],[],[]
17,"two men are working on a brick oven, by Wolf Vostell, irori fireplace, white powder bricks, crumbling masonry, 1987 photograph, traditional fireplace, 1 9 8 5 photograph, 1980s photograph, coating a stubborn core.', by Robert Rauschenberg, 1990 photograph, 1990s photograph",hombre trabajar horno ladrillo wolf vostell chimenea irori ladrillo polvo blanco mampostería fotografía chimenea tradicional fotografía fotografía año ochenta recubrimiento núcleo terco robert rauschenberg fotografía fotografía,273,227,"Año 1930. Uxmal, Yucatán. El staff de la Universidad de Tulane en la fachada oriente del Cuadrángulo de las Monjas, junto a todo el equipo que utilizaron para montar un campamento y para los trabajos de investigación realizados. Éstos trabajos estuvieron a cargo de Frans Blom y fueron supervisados por el arqueólogo yucateco el Arq. José Erosa Peniche.

Fotografía editada y restaurada para una mejor presentación por @yucatanpasadoglorioso",año uxmal yucatán staff universidad tulane fachada oriente cuadrángulo monjas equipo utilizar montar campamento trabajos investigación realizados trabajos cargo frans blom supervisar arqueólogo yucateco arq josé peniche fotográfico editado restaurante presente,441,260,[],[],['yucatanpasadoglorioso'],[]
18,"a newspaper with a picture of a woman in a white dress, jacqueline e, 1 9 9 3 photo from life magazine, tlaquepaque, life magazine, style of mary jackson, ancient ruins behind her, ancient photograph, scans from museum collection, a monumental, featured in life magazine, taken on a 1960s kodak camera",periódico mujer vestido blanco jacqueline revista life tlaquepqueque magazine vida estilo mary jackson ruina antiguo fotografía antiguo escaneo colección museo revista monumental presentado revista life tomado cámara kodak años,301,227,"Año 1930. Uxmal, Yucatán. Personal de la Universidad de Tulane empujando una carreta para poder ingresar su equipo al Cuadrángulo de las Monjas, lugar donde montaron un campamento para estudiar la zona arqueológica.

Fotografía editada y restaurada para una mejor presentación por @yucatanpasadoglorioso",año uxmal yucatán personal universidad tulane empujar carreta parder pogresar equipo cuadrángulo,303,96,[],[],['yucatanpasadoglorioso'],[]
19,"a thatched roof, breakfast at las pozas, tribe huts in the jungle, health spa and meditation center, doors to various living quarters, thatched roof, doorways, akitipe studios, studio ghibi, ecovillage, weta studios, cuban setting, voodo decor, the ayahuasca spirit, archways between stalagtites",techo techo paja desayuno poxas tribe huts the jungle health spa meditation center puerta vivienda techo paja puerta estudio akitipe estudio gibi ecovillage estudios weta escenario cubano decoración voodo espíritu ayahuasca archways stalagtites,295,244,"Año 1930. Miembros del equipo de la Universidad de Tulane de Luisiana, posan en la zona arqueológica de Uxmal, donde montaron un campamento para realizar trabajos de investigación. Éste produjo dibujos, fotografías y moldes para la Exposición Century of Progreso de 1933 de Chicago. Se puede distinguir la bandera de su Universidad colocada en una de las estructuras. Los acompañan el guía Pablo Pantoja, segundo de izquierda a derecha.

Fotografía editada y restaurada para una mejor presentación por @yucatanpasadoglorioso",año miembros delogio universidad tulane luisiana posan zona arqueológicar uxmal montar campamento trabajos investigación produjo dibujos fotografías mold exposición siglo progreso chicago distinguir bandera universidad colocada estructuras acompañan guia pablo pantoja izquierda derecha,524,286,[],[],['yucatanpasadoglorioso'],[]
20,"an aerial view of the house in the middle of the forest, pyramid surrounded with greenery, lost world pyramid, mayan temple in the jungle, ancient alien jungle, a massive cathedral in a forrest, ancient megastructure pyramid, ancient pyramid, giant tomb structures, ancient jungle, maya temples, mayan, the temple of truth is white, aerial view of an ancient land",vista aéreo casa bosque pirámidir rodeado vegetación pirámidir mundo perdido templo maya jungla antiguo junglo alienígén catedral masivo grito pirámide megaestructura antiguo antiguo pirámidir estructura gigante tumba antiguo junglo templo maya maya templo visión blanco visión antiguo antiguo visión antiguo junta antiguo antiguo jungla antiguo templo visión blanco visión blanco antiguo visión blanco antiguo visión blanco antiguo visión blanco antiguo jungla antiguo visión antiguo junglo blanco templo visión visión blanco antiguo,363,534,"Año 1893. Uno de los dos espléndidos pasajes abovedados (arcos triangulares) del Palacio del Gobernador en Uxmal, éstos unían las tres estructuras principales, en fechas posteriores a su construcción fueron bloqueados y construidas pequeñas habitaciones con pórticos de columnas en cada lado. Con el paso del tiempo sus paredes exteriores fueron colapsando quedando sus frentes descubiertos. Cuando fue visitado y dibujado por Frederick Catherwood en 1841, este pasaje en particular se encontraba casi cerrado.

Fotografía antigua tomada por el explorador Teobert Maler en 1893.

Trabajo de edición realizado por @yucatanpasadoglorioso",año espléndidos pasaje abovedado arco triangular palacio gobernador uxmal unir estructuta principal fecha postteriano construcción columnas paso tiempo pared exteriores colapsar quedar frentes descubiertos visitar dibujar frederick catherwood pasaje particular encontrar cerrado,635,278,[],[],['yucatanpasadoglorioso'],[]
